### ISSUE TITLE
OM_MQTT_PORT is ignored

### ISSUE THREAD

**Issue by mfalkvidd** [ClemensElflein/open_mower_ros#182]
The OM MQTT client connects to port 1883 regardless of what `OM_MQTT_PORT` is set to.

Using `OM_VERSION="edge"` and the following conf
```
export OM_MQTT_ENABLE="True"
export OM_MQTT_HOSTNAME="192.168.32.29"
export OM_MQTT_PORT="31883"
export OM_MQTT_USER="openmower"
export OM_MQTT_PASSWORD="HIDDEN"
export OM_MQTT_TOPIC_PREFIX="openmower"
```
Log output:
```
 * /xbot_monitoring/external_mqtt_enable: True
 * /xbot_monitoring/external_mqtt_hostname: 192.168.32.29
 * /xbot_monitoring/external_mqtt_password: HIDDEN...
 * /xbot_monitoring/external_mqtt_port: 31883
 * /xbot_monitoring/external_mqtt_topic_prefix: openmower
 * /xbot_monitoring/external_mqtt_username: openmower
[ INFO] [1746129675.157573237]: Using external MQTT broker: 192.168.32.29:1883 with topic prefix: openmower/
```

So it seems like this row doesn't work? https://github.com/ClemensElflein/xbot_monitoring/blame/e51841df355c4819ed6bd3443f7b4e3381f2e1ad/src/xbot_monitoring.cpp#L574

tshark shows that OM is trying to connect to the specified IP, but using the default port:
```
sudo tshark port 1883
Running as user "root" and group "root". This could be dangerous.
Capturing on 'wlan0'
    1 0.000000000 192.168.32.30 → 192.168.32.29 TCP 74 53932 → 1883 [SYN] Seq=0 Win=64240 Len=0 MSS=1460 SACK_PERM=1 TSval=675019776 TSecr=0 WS=128
    2 0.001580767 192.168.32.29 → 192.168.32.30 TCP 60 1883 → 53932 [RST, ACK] Seq=1 Ack=1 Win=0 Len=0
    3 72.594658337 192.168.32.30 → 192.168.32.29 TCP 74 60418 → 1883 [SYN] Seq=0 Win=64240 Len=0 MSS=1460 SACK_PERM=1 TSval=675092370 TSecr=0 WS=128
    4 72.596181401 192.168.32.29 → 192.168.32.30 TCP 60 1883 → 60418 [RST, ACK] Seq=1 Ack=1 Win=0 Len=0
```

If I change OM_MQTT_HOSTNAME, tshark shows that the ip address changes. But OM_MQTT_PORT has no effect.

**Comment by rovo89** [comment]
This came up on Discord and I fixed it in https://github.com/ClemensElflein/open_mower_ros/pull/222.
